{"type":"config","name":"CUA extraction & agent optimization","metricName":"total_steps","metricUnit":"","bestDirection":"lower"}
{"run":1,"commit":"a61cc0a","metric":23,"metrics":{"raw_steps":23,"success_count":3,"duration_s":92,"case_count":3},"status":"keep","description":"Baseline: readability+markdown extraction. 3/3 success. Case1=7, Case2=3, Case3=13 steps.","timestamp":1774882048186,"segment":0,"confidence":null,"asi":{"hypothesis":"baseline measurement","case1_steps":7,"case2_steps":3,"case3_steps":13,"bottleneck":"case3 admin-count-shops took 13 steps - likely struggling to navigate to shops list","case2_note":"example.com took 3 steps which seems high for simple extraction - could be 1-2"}}
{"run":2,"commit":"c1c2f41","metric":16,"metrics":{"raw_steps":16,"success_count":3,"duration_s":54,"case_count":3},"status":"keep","description":"Prompt: added rules 10-11 (read DOM carefully, admin nav links). Increased DOM snapshot to 3000/4000 chars, markdown truncation to 4000. 23→16 steps, Case3: 13→4.","timestamp":1774882167655,"segment":0,"confidence":null,"asi":{"hypothesis":"Larger DOM + prompt guidance to read DOM before extracting reduces unnecessary steps","case1_steps":9,"case2_steps":3,"case3_steps":4,"key_win":"Case3 admin-count-shops 13→4 steps - agent now reads shop count directly from DOM instead of scrolling around","case1_regression":"Case1 went 7→9 steps, may need attention"}}
{"run":3,"commit":"c1c2f41","metric":20,"metrics":{"raw_steps":20,"success_count":3,"duration_s":60,"case_count":3},"status":"discard","description":"Added markdown mode for selector-based extracts, expanded readability positive patterns + form/table candidates. 16→20 steps, regression.","timestamp":1774882283016,"segment":0,"confidence":2.3333333333333335,"asi":{"hypothesis":"selector-based markdown + admin-friendly readability scoring would help","rollback_reason":"16→20 steps, Case1 regressed 9→12 and Case3 regressed 4→6 despite Case2 improving 3→2","next_action_hint":"LLM nondeterminism is high - focus on structural changes that reduce the number of tool calls needed, not tweaks to extraction quality","case1_steps":12,"case2_steps":2,"case3_steps":6}}
{"run":4,"commit":"e024b52","metric":14,"metrics":{"raw_steps":14,"success_count":3,"duration_s":62,"case_count":3},"status":"keep","description":"DOM snapshot: show 5 table rows (was 3), add page-info counts (paginator/results). 16→14 steps.","timestamp":1774882397374,"segment":0,"confidence":3,"asi":{"hypothesis":"More table rows and page-level count info in DOM helps agent answer without extra navigation","case1_steps":8,"case2_steps":2,"case3_steps":4,"key_insight":"Showing more table data and paginator info lets agent read counts directly from DOM"}}
{"run":5,"commit":"e024b52","metric":23,"metrics":{"raw_steps":23,"success_count":3,"duration_s":80,"case_count":3},"status":"discard","description":"Added rule 12 (combine login+nav), increased MAX_ELEMENTS to 60. Regressed to 23 steps — LLM nondeterminism.","timestamp":1774882523456,"segment":0,"confidence":3,"asi":{"hypothesis":"More prompt rules + more elements would help","rollback_reason":"14→23 regression, extra prompt verbosity may have confused the model","next_action_hint":"User wants to try passing ALL page content (links, buttons, actionable items) to LLM upfront so it can decide in one shot without scrolling"}}
{"run":6,"commit":"0db1b40","metric":14,"metrics":{"raw_steps":14,"success_count":3,"duration_s":44,"case_count":3},"status":"keep","description":"Full page action map: replace DOM snapshot with complete page map (all links/buttons/fields regardless of visibility). Prompt updated to tell agent DOM is complete. Case1: 8→6, Case3: 4→3. Case2: 2→5 regressed but overall tied at 14.","timestamp":1774882743032,"segment":0,"confidence":2.25,"asi":{"hypothesis":"Full page map eliminates need to scroll, agent can act directly on all elements","case1_steps":6,"case2_steps":5,"case3_steps":3,"key_win":"Case1 shop-hours 8→6, Case3 count-shops 4→3","concern":"Case2 example.com 2→5 regressed, bigger DOM may overwhelm for simple pages","next_action_hint":"Try reducing page_map verbosity for simple pages or adding heuristic to use dom_snapshot for small pages"}}
{"run":7,"commit":"b35ab0d","metric":11,"metrics":{"raw_steps":11,"success_count":3,"duration_s":44,"case_count":3},"status":"keep","description":"Confirmation run of page map changes. 14→11 steps. Case1=6, Case2=2, Case3=3. Previous Case2=5 was LLM variance.","timestamp":1774882815865,"segment":0,"confidence":3,"asi":{"hypothesis":"Stability check of page map approach","case1_steps":6,"case2_steps":2,"case3_steps":3,"key_insight":"Page map is stable - Case2 variance (2 vs 5) confirms LLM nondeterminism, not a real regression"}}
{"type":"config","name":"CUA extraction optimization (complex cases)","metricName":"total_steps","metricUnit":"","bestDirection":"lower"}
{"run":8,"commit":"f55395d","metric":13,"metrics":{"raw_steps":13,"success_count":3,"duration_s":45,"case_count":3},"status":"keep","description":"New baseline with 3 complex admin cases: shop-hours(6), agent-details(4), count-shops(3). All pass. 13 total steps.","timestamp":1774883060650,"segment":1,"confidence":null,"asi":{"hypothesis":"baseline for complex case suite","case1_steps":6,"case2_steps":4,"case3_steps":3,"test_cases":"shop-hours (login+navigate+cross-ref+extract), agent-details (login+navigate+click-detail+read-fields), count-shops (login+navigate+read-count)"}}
{"run":9,"commit":"f55395d","metric":13,"metrics":{"raw_steps":13,"success_count":3,"duration_s":48,"case_count":3},"status":"discard","description":"Capped nav to 20 links + increased field value to 150 chars. Same 13 steps, but nav cap is Django-overfitting.","timestamp":1774883194636,"segment":1,"confidence":null,"asi":{"hypothesis":"Trim nav sidebar, increase field value display","rollback_reason":"Nav cap at 20 is overfitting to Django admin - other dashboards may have essential nav links beyond 20","next_action_hint":"Instead of hard-capping nav, try smarter deduplication (remove Add/Change pairs that repeat) or a general char budget that naturally prioritizes content over nav"}}
{"run":10,"commit":"68da979","metric":13,"metrics":{"raw_steps":13,"success_count":3,"duration_s":53,"case_count":3},"status":"keep","description":"General improvements: field value display 80→150 chars, nav budget capped at 30% of total (general, not Django-specific). Same 13 steps, more robust for complex pages.","timestamp":1774883367113,"segment":1,"confidence":null,"asi":{"hypothesis":"Larger field values + proportional nav budget are universally useful without overfitting","case1_steps":6,"case2_steps":4,"case3_steps":3,"note":"Confirmed stable at 13 across 2 runs (13, 14, 13). Field value increase helps LLM read JSON fields without needing extract."}}
{"run":11,"commit":"68da979","metric":14,"metrics":{"raw_steps":14,"success_count":3,"duration_s":49,"case_count":3},"status":"discard","description":"Compacted link format (text → path instead of [text](path)), btn: prefix for buttons. 13→14, within noise but no improvement.","timestamp":1774883488990,"segment":1,"confidence":null,"asi":{"hypothesis":"More compact link/button rendering reduces tokens and LLM latency","rollback_reason":"No improvement, 14 vs 13 baseline","next_action_hint":"Try auto-attaching extract result with DOM context so agent doesn't need separate get_dom after extract. Or try making the page map available to the initial DOM context in the agent loop."}}
{"run":12,"commit":"68da979","metric":15,"metrics":{"raw_steps":15,"success_count":3,"duration_s":63,"case_count":3},"status":"discard","description":"Prompt: encouraged batching goto+login in one sequence. Regressed 13→15.","timestamp":1774883590342,"segment":1,"confidence":null,"asi":{"hypothesis":"Combining goto+login in one execute_sequence saves a step","rollback_reason":"13→15 regression, weakening OBSERVE FIRST rule hurt navigation decisions","next_action_hint":"Don't weaken OBSERVE FIRST - it's critical for reliability. Find other optimization vectors."}}
{"run":13,"commit":"68da979","metric":16,"metrics":{"raw_steps":16,"success_count":3,"duration_s":59,"case_count":3},"status":"discard","description":"Increased table cell text/href lengths. Regressed 13→16.","timestamp":1774883678005,"segment":1,"confidence":null,"asi":{"hypothesis":"Wider table cells give LLM more context per row","rollback_reason":"13→16 regression, more verbose tables may slow LLM processing"}}
{"run":14,"commit":"ad80c58","metric":13,"metrics":{"raw_steps":13,"success_count":3,"duration_s":52,"case_count":3},"status":"keep","description":"Pre-inject page_map.js and readability_extract.js via add_init_script (no more lazy init overhead). Same 13 steps, faster first-extract.","timestamp":1774883838137,"segment":1,"confidence":null,"asi":{"hypothesis":"Pre-injecting JS helpers eliminates lazy-init delay on first extract/page_map call","case1_steps":6,"case2_steps":4,"case3_steps":3,"note":"Architecturally cleaner - all JS helpers injected consistently via add_init_script"}}
{"run":15,"commit":"cd301e1","metric":13,"metrics":{"raw_steps":13,"success_count":3,"duration_s":50,"case_count":3},"status":"keep","description":"Extract action now auto-attaches page map context. Same 13 steps (extract is last action in these cases), but helps mid-task extracts.","timestamp":1774883922978,"segment":1,"confidence":null,"asi":{"hypothesis":"Attaching page map after extract lets agent act immediately without needing a separate get_dom","case1_steps":6,"case2_steps":4,"case3_steps":3,"note":"No step reduction since extract is typically the final action. But for tasks with mid-flow extracts this saves a step."}}
{"run":16,"commit":"cd301e1","metric":13,"metrics":{"raw_steps":13,"success_count":3,"duration_s":74,"case_count":3},"status":"discard","description":"Medium thinking with Gemini Flash. Same 13 steps but duration regressed 50s→74s — medium thinking is slower, not faster.","timestamp":1774884044190,"segment":1,"confidence":null,"asi":{"hypothesis":"Lower thinking effort = faster LLM responses","rollback_reason":"Duration 50s→74s regression. Medium thinking may cause more retries or less efficient reasoning","next_action_hint":"User wants to test different models (Sonnet, GPT-5.4) with 10 runs each to find ideal combination"}}
{"run":17,"commit":"cd301e1","metric":37,"metrics":{"raw_steps":27,"success_count":2,"duration_s":77,"case_count":3},"status":"discard","description":"Confirmation run after fixing autoresearch.sh (removed stale --thinking medium). Case1 failed - LLM variance bad run.","timestamp":1774884705246,"segment":1,"confidence":null,"asi":{"hypothesis":"Confirm baseline still works after script fix","rollback_reason":"Bad LLM variance run, Case1 failed"}}
